{
  "schema_version": "1.0",
  "job_id": "e2bb16f4-bb1c-57b6-9beb-36efb1c58be6",
  "status": "completed",
  "project": {
    "project_id": "sample-office",
    "project_name": "Sample Office",
    "gross_floor_area_m2": 500.0
  },
  "summary": {
    "total_kgco2e": 19365.0,
    "total_tco2e": 19.365,
    "carbon_intensity_kgco2e_m2": 38.73,
    "record_count": 6,
    "unmatched_material_count": 0
  },
  "records": [
    {
      "material": "Concrete C30/37",
      "environmental_product_declaration": "Sample concrete EPD",
      "metric": "ClimateChangeTotal",
      "module": "A1",
      "value": 1200.0,
      "unit": "kgCO2e"
    },
    {
      "material": "Concrete C30/37",
      "environmental_product_declaration": "Sample concrete EPD",
      "metric": "ClimateChangeTotal",
      "module": "A2",
      "value": 240.0,
      "unit": "kgCO2e"
    },
    {
      "material": "Concrete C30/37",
      "environmental_product_declaration": "Sample concrete EPD",
      "metric": "ClimateChangeTotal",
      "module": "A3",
      "value": 1440.0,
      "unit": "kgCO2e"
    },
    {
      "material": "Structural Steel",
      "environmental_product_declaration": "Sample steel EPD",
      "metric": "ClimateChangeTotal",
      "module": "A1",
      "value": 8478.0,
      "unit": "kgCO2e"
    },
    {
      "material": "Structural Steel",
      "environmental_product_declaration": "Sample steel EPD",
      "metric": "ClimateChangeTotal",
      "module": "A2",
      "value": 942.0,
      "unit": "kgCO2e"
    },
    {
      "material": "Structural Steel",
      "environmental_product_declaration": "Sample steel EPD",
      "metric": "ClimateChangeTotal",
      "module": "A3",
      "value": 7065.0,
      "unit": "kgCO2e"
    }
  ],
  "unmatched_materials": [],
  "warnings": []
}
